{"$defs":{"package":{"additionalProperties":false,"properties":{"direct":{"type":"boolean"},"installedCodeTreeSha256":{"$ref":"#/$defs/sha256"},"name":{"minLength":1,"type":"string"},"version":{"minLength":1,"type":"string"},"wheelFilename":{"pattern":"^[^/\\\\]+\\.whl$","type":"string"},"wheelSha256":{"$ref":"#/$defs/sha256"},"wheelTag":{"minLength":1,"type":"string"}},"required":["name","version","direct","wheelFilename","wheelTag","wheelSha256","installedCodeTreeSha256"],"type":"object"},"sha256":{"pattern":"^sha256:[0-9a-f]{64}$","type":"string"}},"$id":"https://sfep.local/contracts/equipment-monitor/v1/producer_runtime.schema.json","$schema":"https://json-schema.org/draft/2020-12/schema","additionalProperties":false,"properties":{"environmentPolicy":{"additionalProperties":false,"properties":{"floatPolicy":{"const":"IEEE754_BINARY64_FINITE"},"localeIndependentParsing":{"const":true},"pythonHashSeed":{"const":"0"},"timezone":{"const":"Asia/Seoul"}},"required":["pythonHashSeed","timezone","localeIndependentParsing","floatPolicy"],"type":"object"},"locks":{"additionalProperties":false,"properties":{"bootstrap":{"$ref":"#/$defs/sha256"},"buildRequirements":{"$ref":"#/$defs/sha256"},"producer":{"$ref":"#/$defs/sha256"},"pyproject":{"$ref":"#/$defs/sha256"},"requirements":{"$ref":"#/$defs/sha256"},"wheelhouse":{"$ref":"#/$defs/sha256"}},"required":["pyproject","bootstrap","buildRequirements","requirements","wheelhouse","producer"],"type":"object"},"packages":{"items":{"$ref":"#/$defs/package"},"minItems":1,"type":"array"},"pipVersion":{"const":"25.1.1"},"platform":{"additionalProperties":false,"properties":{"machine":{"const":"arm64"},"macosProductVersion":{"minLength":1,"type":"string"},"sysconfigPlatform":{"minLength":1,"type":"string"},"system":{"const":"Darwin"}},"required":["system","machine","macosProductVersion","sysconfigPlatform"],"type":"object"},"producer":{"additionalProperties":false,"properties":{"installedCodeTreeSha256":{"$ref":"#/$defs/sha256"},"name":{"const":"equipment-quality"},"sourceSha256":{"$ref":"#/$defs/sha256"},"version":{"minLength":1,"type":"string"},"wheelFilename":{"pattern":"^[^/\\\\]+\\.whl$","type":"string"},"wheelSha256":{"$ref":"#/$defs/sha256"}},"required":["name","version","wheelFilename","wheelSha256","installedCodeTreeSha256","sourceSha256"],"type":"object"},"python":{"additionalProperties":false,"properties":{"build":{"minLength":1,"type":"string"},"cacheTag":{"const":"cpython-312"},"executableSha256":{"$ref":"#/$defs/sha256"},"implementation":{"const":"CPython"},"soabi":{"pattern":"^cpython-312","type":"string"},"version":{"const":"3.12.10"}},"required":["implementation","version","build","cacheTag","soabi","executableSha256"],"type":"object"},"schemaVersion":{"const":"sfep-producer-runtime/v1"}},"required":["schemaVersion","platform","python","pipVersion","locks","packages","producer","environmentPolicy"],"type":"object"}
