{"environmentPolicy":{"floatPolicy":"IEEE754_BINARY64_FINITE","localeIndependentParsing":true,"pythonHashSeed":"0","timezone":"Asia/Seoul"},"locks":{"bootstrap":"sha256:9994816214185cd82bde3c2428852b6a8c77b156c54d01ec139f7f08e10832b8","buildRequirements":"sha256:097e72ac9f7ba259d530f3a09fd10f840c58ff094761a4c17fb0c9ca8c72c4cb","producer":"sha256:0a8435556a3b31fd8034b60ed1d9b098e521b1cbeeae5ca008af0c19a9da3344","pyproject":"sha256:a7f07d4c8f92113cdc1cd5ee02a2611b2e84951db0969088ec82f26be6ba8fbe","requirements":"sha256:1fa66c13e8e7bcd8df20ead99b1adfafb227a08691fb67d8bd80861c7d8549ec","wheelhouse":"sha256:6e8ed7650891c4651586b05a561b00a85be81fd8a9ce9a264b5b710ee7b4af43"},"packages":[{"direct":false,"installedCodeTreeSha256":"sha256:75b19dca2c16d96accf27b901ecae9f76c3545e52f9c09ae3d6360404d566efc","name":"attrs","version":"26.1.0","wheelFilename":"attrs-26.1.0-py3-none-any.whl","wheelSha256":"sha256:c647aa4a12dfbad9333ca4e71fe62ddc36f4e63b2d260a37a8b83d2f043ac309","wheelTag":"py3-none-any"},{"direct":true,"installedCodeTreeSha256":"sha256:1e4ad21d860daeedf9e6add6006372954b5e92c7c91ca4afc687b0c5e63509c5","name":"jsonschema","version":"4.24.0","wheelFilename":"jsonschema-4.24.0-py3-none-any.whl","wheelSha256":"sha256:a462455f19f5faf404a7902952b6f0e3ce868f3ee09a359b05eca6673bd8412d","wheelTag":"py3-none-any"},{"direct":false,"installedCodeTreeSha256":"sha256:b2155c81a6046e92f2e4c5f08ea57d26ae3f739feeec5d772bd7937f12ea0dee","name":"jsonschema-specifications","version":"2025.9.1","wheelFilename":"jsonschema_specifications-2025.9.1-py3-none-any.whl","wheelSha256":"sha256:98802fee3a11ee76ecaca44429fda8a41bff98b00a0f2838151b113f210cc6fe","wheelTag":"py3-none-any"},{"direct":true,"installedCodeTreeSha256":"sha256:38d5eae90ee9fb3193146c3f7ad58fbc8a645697dfc050c6b2deee68a4e85659","name":"numpy","version":"2.2.6","wheelFilename":"numpy-2.2.6-cp312-cp312-macosx_14_0_arm64.whl","wheelSha256":"sha256:894b3a42502226a1cac872f840030665f33326fc3dac8e57c607905773cdcde3","wheelTag":"cp312-cp312-macosx_14_0_arm64"},{"direct":true,"installedCodeTreeSha256":"sha256:7dafd5f0a9ae1f1b07c16e86ca310cef5df0c41823ce4e4b65e9f2df429c2f28","name":"pandas","version":"2.3.0","wheelFilename":"pandas-2.3.0-cp312-cp312-macosx_11_0_arm64.whl","wheelSha256":"sha256:b9d8c3187be7479ea5c3d30c32a5d73d62a621166675063b2edd21bc47614027","wheelTag":"cp312-cp312-macosx_11_0_arm64"},{"direct":false,"installedCodeTreeSha256":"sha256:ccc67307b96962156dfd51dafc4cf89516a5532f49c4c4e4399975ca8e273529","name":"python-dateutil","version":"2.9.0.post0","wheelFilename":"python_dateutil-2.9.0.post0-py2.py3-none-any.whl","wheelSha256":"sha256:a8b2bc7bffae282281c8140a97d3aa9c14da0b136dfe83f850eea9a5f7470427","wheelTag":"py2.py3-none-any"},{"direct":false,"installedCodeTreeSha256":"sha256:e23d536766047f30b07313f6c3ce8f986a95ac90a5546d2d3bb744bb5c3fd973","name":"pytz","version":"2026.3.post1","wheelFilename":"pytz-2026.3.post1-py2.py3-none-any.whl","wheelSha256":"sha256:dd95840dd199baea12d9cc096a1d452caa6596a1c1e4b5f3dbd1541855d5e815","wheelTag":"py2.py3-none-any"},{"direct":false,"installedCodeTreeSha256":"sha256:26da869fd91e32fec17da9a7a6482011551bb9de31c75bebeef4c9d0778bcfb9","name":"referencing","version":"0.37.0","wheelFilename":"referencing-0.37.0-py3-none-any.whl","wheelSha256":"sha256:381329a9f99628c9069361716891d34ad94af76e461dcb0335825aecc7692231","wheelTag":"py3-none-any"},{"direct":false,"installedCodeTreeSha256":"sha256:8666a270ab0942cc1a2c7b37cd2a924c91e7f333054c1ed429373adb5c5b7719","name":"rpds-py","version":"2026.6.3","wheelFilename":"rpds_py-2026.6.3-cp312-cp312-macosx_11_0_arm64.whl","wheelSha256":"sha256:538949e262e46caa31ac01bdb3c1e8f642622922cacbabbae6a8445d9dc33eaf","wheelTag":"cp312-cp312-macosx_11_0_arm64"},{"direct":false,"installedCodeTreeSha256":"sha256:b77c2bf5826dd5f88505e9e434f8766909987832b6fddff85aec9f91223552eb","name":"six","version":"1.17.0","wheelFilename":"six-1.17.0-py2.py3-none-any.whl","wheelSha256":"sha256:4721f391ed90541fddacab5acf947aa0d3dc7d27b2e1e8eda2be8970586c3274","wheelTag":"py2.py3-none-any"},{"direct":false,"installedCodeTreeSha256":"sha256:d250c3e1f05f87a13f05e421058e1045270052ad6ba850b06f77c5b702fca312","name":"typing-extensions","version":"4.16.0","wheelFilename":"typing_extensions-4.16.0-py3-none-any.whl","wheelSha256":"sha256:481caa481374e813c1b176ada14e97f1f67a4539ce9cfeb3f350d78d6370c2e8","wheelTag":"py3-none-any"},{"direct":false,"installedCodeTreeSha256":"sha256:93053276b11cb56b57d6f31a9575e0da1b2a8bb9d04786c8c0aa650d3bc9d8c8","name":"tzdata","version":"2026.3","wheelFilename":"tzdata-2026.3-py2.py3-none-any.whl","wheelSha256":"sha256:dc096730c87af6cab1b171c9d532be840741ff5d459015e7f6947bd7d7e54931","wheelTag":"py2.py3-none-any"}],"pipVersion":"25.1.1","platform":{"machine":"arm64","macosProductVersion":"26.6.2","sysconfigPlatform":"macosx-11.0-arm64","system":"Darwin"},"producer":{"installedCodeTreeSha256":"sha256:3308986877d480d015818abc328d822fb5ee5a9552432f372471599a0b472c3d","name":"equipment-quality","sourceSha256":"sha256:397503b54a059b2764e1a7149d132999dbd10c0aef0128e6a3a1cb8eab250d73","version":"1.0.0","wheelFilename":"sfep_equipment_quality-1.0.0-py3-none-any.whl","wheelSha256":"sha256:b2e24deb79e5beeab218c7676d62ee0aede98a2d9d876b5f8d836cf7f7fc0ee0"},"python":{"build":"main Apr 10 2025 22:19:24","cacheTag":"cpython-312","executableSha256":"sha256:5ed8d4bc2b33e83253db7dbf18d64dfe60c5ed990fce587d800e8d25d4e6ee5f","implementation":"CPython","soabi":"cpython-312-darwin","version":"3.12.10"},"schemaVersion":"sfep-producer-runtime/v1"}
